{
  "artifacts": [
    {
      "kind": "train_O_H4_seed42_console",
      "path_or_uri": "/workspace/phase2/cartpole_controlled_study/training_logs/O_H4__seed42.log",
      "sha256": "0dd4b7926f1be2e75b959baf699399073860ebbcd976e0650393ba4bd17cf5b6"
    },
    {
      "kind": "training_run_directory",
      "path_or_uri": "/workspace/isaaclab/logs/skrl/cartpole/2026-07-27_01-29-49_ppo_torch",
      "sha256": null
    },
    {
      "kind": "primary_checkpoint",
      "path_or_uri": "/workspace/isaaclab/logs/skrl/cartpole/2026-07-27_01-29-49_ppo_torch/checkpoints/agent_2400.pt",
      "sha256": "20d5baf18ff251cd16d9def685a7b88f9cab9cbb86112b110875c4ee7b3ddd53"
    },
    {
      "kind": "screening_O_H4_console",
      "path_or_uri": "/workspace/phase2/cartpole_controlled_study/evaluation_logs/screening_O_H4.log",
      "sha256": "e14e743ee4b8ec919e3b923d6cdebc0ced8cd0142c768eb065e148547a59d742"
    },
    {
      "kind": "screening_evaluation",
      "path_or_uri": "/workspace/phase2/cartpole_controlled_study/evaluations/screening/O_H4.json",
      "sha256": "2b39a7392615c8bea23ab0eb05479071da8994e719da30e1907e72e9eaae1f09"
    },
    {
      "kind": "final_evaluation",
      "path_or_uri": "/workspace/phase2/cartpole_controlled_study/evaluations/final/O_H4.json",
      "sha256": "0bd844d63dc01e058a4d4b01a615d596272819c99b1b126e6f20e7ebeb4bed54"
    }
  ],
  "commands": [
    {
      "command": "/workspace/isaaclab/isaaclab.sh -p scripts/reinforcement_learning/train.py --rl_library=skrl --task=Isaac-Cartpole-v0 --algorithm=PPO --seed=42 --num_envs=4096 --viz none env.observations.policy.joint_vel_rel=null env.observations.policy.joint_pos_rel.history_length=4",
      "ended_at": "2026-07-27T01:31:11.186605+00:00",
      "exit_code": 0,
      "stage": "train_O_H4_seed42",
      "started_at": "2026-07-27T01:29:17.988195+00:00",
      "wall_seconds": 113.198094354
    },
    {
      "command": "/workspace/isaaclab/isaaclab.sh -p /workspace/robotics-issac-learning/tools/evaluate_cartpole.py --policy=sweep --task=Isaac-Cartpole-v0 --checkpoint-dir=/workspace/isaaclab/logs/skrl/cartpole/2026-07-27_01-29-49_ppo_torch/checkpoints --training-num-envs=4096 --seeds=101,202,303,404,505 --episodes-per-seed=5 --num-envs=5 --max-steps-per-seed=1000 --upright-threshold-degrees=12.0 --robust-success-upright-fraction=0.95 --action-sign-deadband=0.05 --output=/workspace/phase2/cartpole_controlled_study/evaluations/screening/O_H4.json --viz none env.observations.policy.joint_vel_rel=null env.observations.policy.joint_pos_rel.history_length=4",
      "ended_at": "2026-07-27T01:31:33.191421+00:00",
      "exit_code": 0,
      "stage": "screening_O_H4",
      "started_at": "2026-07-27T01:31:11.188881+00:00",
      "wall_seconds": 22.00203980699996
    },
    {
      "command": "/workspace/isaaclab/isaaclab.sh -p /workspace/robotics-issac-learning/tools/evaluate_cartpole.py --policy=sweep --task=Isaac-Cartpole-v0 --checkpoint-dir=/workspace/isaaclab/logs/skrl/cartpole/2026-07-27_01-29-49_ppo_torch/checkpoints --training-num-envs=4096 --seeds=101,202,303,404,505 --episodes-per-seed=5 --num-envs=5 --max-steps-per-seed=1000 --upright-threshold-degrees=12.0 --robust-success-upright-fraction=0.95 --action-sign-deadband=0.05 --output=/workspace/phase2/cartpole_controlled_study/evaluations/screening/O_H4.json --viz none env.observations.policy.joint_vel_rel=null env.observations.policy.joint_pos_rel.history_length=4",
      "ended_at": "2026-07-27T01:33:25.976901+00:00",
      "exit_code": 0,
      "stage": "screening_O_H4",
      "started_at": "2026-07-27T01:33:03.377122+00:00",
      "wall_seconds": 22.599431349999975
    },
    {
      "command": "/workspace/isaaclab/isaaclab.sh -p scripts/reinforcement_learning/train.py --rl_library=skrl --task=Isaac-Cartpole-v0 --algorithm=PPO --seed=42 --num_envs=4096 --viz none env.observations.policy.joint_vel_rel=null env.observations.policy.joint_pos_rel.history_length=4",
      "ended_at": null,
      "exit_code": null,
      "stage": "train_O_H4_seed42",
      "started_at": "2026-07-27T01:33:30.677140+00:00",
      "wall_seconds": null
    },
    {
      "command": "/workspace/isaaclab/isaaclab.sh -p /workspace/robotics-issac-learning/tools/evaluate_cartpole.py --policy=sweep --task=Isaac-Cartpole-v0 --checkpoint-dir=/workspace/isaaclab/logs/skrl/cartpole/2026-07-27_01-29-49_ppo_torch/checkpoints --training-num-envs=4096 --seeds=101,202,303,404,505 --episodes-per-seed=5 --num-envs=5 --max-steps-per-seed=1000 --upright-threshold-degrees=12.0 --robust-success-upright-fraction=0.95 --action-sign-deadband=0.05 --output=/workspace/phase2/cartpole_controlled_study/evaluations/screening/O_H4.json --viz none env.observations.policy.joint_vel_rel=null env.observations.policy.joint_pos_rel.history_length=4",
      "ended_at": "2026-07-27T01:37:09.928745+00:00",
      "exit_code": 0,
      "stage": "screening_O_H4",
      "started_at": "2026-07-27T01:34:58.595948+00:00",
      "wall_seconds": 131.33239511300008
    },
    {
      "command": "/workspace/isaaclab/isaaclab.sh -p /workspace/robotics-issac-learning/tools/evaluate_cartpole.py --policy=sweep --task=Isaac-Cartpole-v0 --checkpoint-dir=/workspace/isaaclab/logs/skrl/cartpole/2026-07-27_01-29-49_ppo_torch/checkpoints --training-num-envs=4096 --seeds=101 --episodes-per-seed=25 --num-envs=25 --max-steps-per-seed=1000 --upright-threshold-degrees=12.0 --robust-success-upright-fraction=0.95 --action-sign-deadband=0.05 --output=/workspace/phase2/cartpole_controlled_study/evaluations/screening/O_H4.json --viz none env.observations.policy.joint_vel_rel=null env.observations.policy.joint_pos_rel.history_length=4",
      "ended_at": "2026-07-27T02:24:32.283769+00:00",
      "exit_code": 0,
      "stage": "screening_O_H4",
      "started_at": "2026-07-27T02:23:47.555283+00:00",
      "wall_seconds": 44.7281256680003
    }
  ],
  "evaluation": {
    "episodes_per_seed": 25,
    "fixed_environment_ids": [
      0,
      1,
      2,
      3,
      4,
      5,
      6,
      7,
      8,
      9,
      10,
      11,
      12,
      13,
      14,
      15,
      16,
      17,
      18,
      19,
      20,
      21,
      22,
      23,
      24
    ],
    "profile_ids": [
      "canonical5",
      "stress30"
    ],
    "seeds": [
      101
    ]
  },
  "failure": null,
  "provenance": {
    "git_commit": "f89f1e3bd977ab9bf9553c46c987195a104160a1",
    "git_dirty": false,
    "gpu": {},
    "resolved_agent_sha256": null,
    "resolved_env_sha256": null,
    "software": {}
  },
  "run_id": "phase2_cartpole_controlled_ablation__O_H4__seed42",
  "schema_version": 1,
  "status": "succeeded",
  "study_id": "phase2_cartpole_controlled_ablation",
  "training": {
    "checkpoint_vector_step": 2400,
    "num_envs": 4096,
    "seed": 42,
    "task": "Isaac-Cartpole-v0"
  },
  "variant": {
    "contrast_variant_id": "O_POS",
    "expected_diff": [
      {
        "path": "env.observations.policy.joint_vel_rel",
        "value": null
      },
      {
        "path": "env.observations.policy.joint_pos_rel.history_length",
        "value": 4
      }
    ],
    "factor": "observation",
    "factor_level": "position_history_4",
    "id": "O_H4",
    "interface_contract_sha256": "3efddcc0c46fcb8ac24ef566695b4947e86a97af5efaaebb001ba8ad55c7d1fd",
    "registry_sha256": "72c2bf04bda3213469068e31c489e0439a51ab49cfef25ec022b998d3465fa5d"
  }
}
