{
  "artifacts": [
    {
      "kind": "train_T_B60_seed123_console",
      "path_or_uri": "/workspace/phase2/cartpole_controlled_study/training_logs/T_B60__seed123.log",
      "sha256": "c490f7750a7897bd7fde4f3181a8ed245fd1a7b83523961002a428b20e75e8fa"
    },
    {
      "kind": "training_run_directory",
      "path_or_uri": "/workspace/isaaclab/logs/skrl/cartpole/2026-07-27_02-20-23_ppo_torch",
      "sha256": null
    },
    {
      "kind": "primary_checkpoint",
      "path_or_uri": "/workspace/isaaclab/logs/skrl/cartpole/2026-07-27_02-20-23_ppo_torch/checkpoints/agent_2400.pt",
      "sha256": "70af413669e573110c8259fa4a08cc5102f170db9d801676a248eb2dd82add59"
    },
    {
      "kind": "final_evaluation",
      "path_or_uri": "/workspace/phase2/cartpole_controlled_study/evaluations/final/T_B60.json",
      "sha256": "70d8ea3dbc1c3132257c11b589fa46f7d5db84ee14035d01f428ae4590a0c844"
    }
  ],
  "commands": [
    {
      "command": "/workspace/isaaclab/isaaclab.sh -p scripts/reinforcement_learning/train.py --rl_library=skrl --task=Isaac-Cartpole-v0 --algorithm=PPO --seed=123 --num_envs=4096 --viz none 'env.terminations.cart_out_of_bounds.params.bounds=[-6.0,6.0]'",
      "ended_at": "2026-07-27T02:21:28.939984+00:00",
      "exit_code": 0,
      "stage": "train_T_B60_seed123",
      "started_at": "2026-07-27T02:20:07.185628+00:00",
      "wall_seconds": 81.75398942999982
    }
  ],
  "evaluation": {
    "episodes_per_seed": 25,
    "fixed_environment_ids": [
      0,
      1,
      2,
      3,
      4,
      5,
      6,
      7,
      8,
      9,
      10,
      11,
      12,
      13,
      14,
      15,
      16,
      17,
      18,
      19,
      20,
      21,
      22,
      23,
      24
    ],
    "profile_ids": [
      "stress30"
    ],
    "seeds": [
      101
    ]
  },
  "failure": null,
  "provenance": {
    "git_commit": "a2ddcc55747b6b0e1a46451369a371734315ebff",
    "git_dirty": false,
    "gpu": {},
    "resolved_agent_sha256": null,
    "resolved_env_sha256": null,
    "software": {}
  },
  "run_id": "phase2_cartpole_controlled_ablation__T_B60__seed123",
  "schema_version": 1,
  "status": "succeeded",
  "study_id": "phase2_cartpole_controlled_ablation",
  "training": {
    "checkpoint_vector_step": 2400,
    "num_envs": 4096,
    "seed": 123,
    "task": "Isaac-Cartpole-v0"
  },
  "variant": {
    "contrast_variant_id": "B0",
    "expected_diff": [
      {
        "path": "env.terminations.cart_out_of_bounds.params.bounds",
        "value": [
          -6.0,
          6.0
        ]
      }
    ],
    "factor": "termination",
    "factor_level": 6.0,
    "id": "T_B60",
    "interface_contract_sha256": "4f53cda18c2baa0c0354bb5f9a3ecbe5ed12ab4d8e11ba873c2f11161202b945",
    "registry_sha256": "72c2bf04bda3213469068e31c489e0439a51ab49cfef25ec022b998d3465fa5d"
  }
}
