{
  "artifacts": [
    {
      "kind": "train_A_E50_seed7_console",
      "path_or_uri": "/workspace/phase2/cartpole_controlled_study/training_logs/A_E50__seed7.log",
      "sha256": "d94e5d9d35d209e36eb2caa71c104e91a80089a14b0bc78c1420994829fd0d0e"
    },
    {
      "kind": "training_run_directory",
      "path_or_uri": "/workspace/isaaclab/logs/skrl/cartpole/2026-07-27_02-09-50_ppo_torch",
      "sha256": null
    },
    {
      "kind": "primary_checkpoint",
      "path_or_uri": "/workspace/isaaclab/logs/skrl/cartpole/2026-07-27_02-09-50_ppo_torch/checkpoints/agent_2400.pt",
      "sha256": "1f278fd95ec164b28424106a0c1317d2ebb6c3672e2afe7f4d00cafcfb5e950f"
    },
    {
      "kind": "final_evaluation",
      "path_or_uri": "/workspace/phase2/cartpole_controlled_study/evaluations/final/A_E50.json",
      "sha256": "bd4c6d46db57120a07ebfd6b043e9e246609a3dccc986db9fa4c2ed7f9bc74c0"
    }
  ],
  "commands": [
    {
      "command": "/workspace/isaaclab/isaaclab.sh -p scripts/reinforcement_learning/train.py --rl_library=skrl --task=Isaac-Cartpole-v0 --algorithm=PPO --seed=7 --num_envs=4096 --viz none env.actions.joint_effort.scale=50.0",
      "ended_at": "2026-07-27T02:11:06.762634+00:00",
      "exit_code": 0,
      "stage": "train_A_E50_seed7",
      "started_at": "2026-07-27T02:09:34.930769+00:00",
      "wall_seconds": 91.831451475
    }
  ],
  "evaluation": {
    "episodes_per_seed": 25,
    "fixed_environment_ids": [
      0,
      1,
      2,
      3,
      4,
      5,
      6,
      7,
      8,
      9,
      10,
      11,
      12,
      13,
      14,
      15,
      16,
      17,
      18,
      19,
      20,
      21,
      22,
      23,
      24
    ],
    "profile_ids": [
      "stress30"
    ],
    "seeds": [
      101
    ]
  },
  "failure": null,
  "provenance": {
    "git_commit": "a2ddcc55747b6b0e1a46451369a371734315ebff",
    "git_dirty": false,
    "gpu": {},
    "resolved_agent_sha256": null,
    "resolved_env_sha256": null,
    "software": {}
  },
  "run_id": "phase2_cartpole_controlled_ablation__A_E50__seed7",
  "schema_version": 1,
  "status": "succeeded",
  "study_id": "phase2_cartpole_controlled_ablation",
  "training": {
    "checkpoint_vector_step": 2400,
    "num_envs": 4096,
    "seed": 7,
    "task": "Isaac-Cartpole-v0"
  },
  "variant": {
    "contrast_variant_id": "B0",
    "expected_diff": [
      {
        "path": "env.actions.joint_effort.scale",
        "value": 50.0
      }
    ],
    "factor": "action",
    "factor_level": 50.0,
    "id": "A_E50",
    "interface_contract_sha256": "8cb39f6d807fe9900e622812700b440e99a76f3a21edbcd8d005a7f155fd3e10",
    "registry_sha256": "72c2bf04bda3213469068e31c489e0439a51ab49cfef25ec022b998d3465fa5d"
  }
}
