{
  "artifacts": [
    {
      "kind": "train_O_H4_seed123_console",
      "path_or_uri": "/workspace/phase2/cartpole_controlled_study/training_logs/O_H4__seed123.log",
      "sha256": "f3818fe4a90b874955bc5154412106c92675eb1f46ea2b59dad930a06b1289af"
    },
    {
      "kind": "training_run_directory",
      "path_or_uri": "/workspace/isaaclab/logs/skrl/cartpole/2026-07-27_02-02-11_ppo_torch",
      "sha256": null
    },
    {
      "kind": "primary_checkpoint",
      "path_or_uri": "/workspace/isaaclab/logs/skrl/cartpole/2026-07-27_02-02-11_ppo_torch/checkpoints/agent_2400.pt",
      "sha256": "9d89de39df287fcf0dca7a59cdb03a9fbfa2bf29fb71d71a1bf434c12cd540af"
    },
    {
      "kind": "final_evaluation",
      "path_or_uri": "/workspace/phase2/cartpole_controlled_study/evaluations/final/O_H4.json",
      "sha256": "0bd844d63dc01e058a4d4b01a615d596272819c99b1b126e6f20e7ebeb4bed54"
    }
  ],
  "commands": [
    {
      "command": "/workspace/isaaclab/isaaclab.sh -p scripts/reinforcement_learning/train.py --rl_library=skrl --task=Isaac-Cartpole-v0 --algorithm=PPO --seed=123 --num_envs=4096 --viz none env.observations.policy.joint_vel_rel=null env.observations.policy.joint_pos_rel.history_length=4",
      "ended_at": "2026-07-27T02:03:27.070809+00:00",
      "exit_code": 0,
      "stage": "train_O_H4_seed123",
      "started_at": "2026-07-27T02:01:55.344795+00:00",
      "wall_seconds": 91.72570972299991
    }
  ],
  "evaluation": {
    "episodes_per_seed": 25,
    "fixed_environment_ids": [
      0,
      1,
      2,
      3,
      4,
      5,
      6,
      7,
      8,
      9,
      10,
      11,
      12,
      13,
      14,
      15,
      16,
      17,
      18,
      19,
      20,
      21,
      22,
      23,
      24
    ],
    "profile_ids": [
      "stress30"
    ],
    "seeds": [
      101
    ]
  },
  "failure": null,
  "provenance": {
    "git_commit": "a2ddcc55747b6b0e1a46451369a371734315ebff",
    "git_dirty": false,
    "gpu": {},
    "resolved_agent_sha256": null,
    "resolved_env_sha256": null,
    "software": {}
  },
  "run_id": "phase2_cartpole_controlled_ablation__O_H4__seed123",
  "schema_version": 1,
  "status": "succeeded",
  "study_id": "phase2_cartpole_controlled_ablation",
  "training": {
    "checkpoint_vector_step": 2400,
    "num_envs": 4096,
    "seed": 123,
    "task": "Isaac-Cartpole-v0"
  },
  "variant": {
    "contrast_variant_id": "O_POS",
    "expected_diff": [
      {
        "path": "env.observations.policy.joint_vel_rel",
        "value": null
      },
      {
        "path": "env.observations.policy.joint_pos_rel.history_length",
        "value": 4
      }
    ],
    "factor": "observation",
    "factor_level": "position_history_4",
    "id": "O_H4",
    "interface_contract_sha256": "3efddcc0c46fcb8ac24ef566695b4947e86a97af5efaaebb001ba8ad55c7d1fd",
    "registry_sha256": "72c2bf04bda3213469068e31c489e0439a51ab49cfef25ec022b998d3465fa5d"
  }
}
