{
  "artifacts": [
    {
      "kind": "train_R_CV2_seed7_console",
      "path_or_uri": "/workspace/phase2/cartpole_controlled_study/training_logs/R_CV2__seed7.log",
      "sha256": "43f1f5ac216c7523d1afad7e2ed690e81b79b0f29360a720d2f2e58b85236bff"
    },
    {
      "kind": "training_run_directory",
      "path_or_uri": "/workspace/isaaclab/logs/skrl/cartpole/2026-07-27_02-06-46_ppo_torch",
      "sha256": null
    },
    {
      "kind": "primary_checkpoint",
      "path_or_uri": "/workspace/isaaclab/logs/skrl/cartpole/2026-07-27_02-06-46_ppo_torch/checkpoints/agent_2400.pt",
      "sha256": "f5b98862b39e981e1f0e7fb149d7a123d8d73dd7a96e9b9b0450382dbd36caa5"
    },
    {
      "kind": "final_evaluation",
      "path_or_uri": "/workspace/phase2/cartpole_controlled_study/evaluations/final/R_CV2.json",
      "sha256": "84f2659722cd95ec00d3082b4ac2337e150fe8060889397b68f6dc8fd1864682"
    }
  ],
  "commands": [
    {
      "command": "/workspace/isaaclab/isaaclab.sh -p scripts/reinforcement_learning/train.py --rl_library=skrl --task=Isaac-Cartpole-v0 --algorithm=PPO --seed=7 --num_envs=4096 --viz none env.rewards.cart_vel.weight=-0.02",
      "ended_at": "2026-07-27T02:08:02.491209+00:00",
      "exit_code": 0,
      "stage": "train_R_CV2_seed7",
      "started_at": "2026-07-27T02:06:30.253016+00:00",
      "wall_seconds": 92.23789393800007
    }
  ],
  "evaluation": {
    "episodes_per_seed": 25,
    "fixed_environment_ids": [
      0,
      1,
      2,
      3,
      4,
      5,
      6,
      7,
      8,
      9,
      10,
      11,
      12,
      13,
      14,
      15,
      16,
      17,
      18,
      19,
      20,
      21,
      22,
      23,
      24
    ],
    "profile_ids": [
      "stress30"
    ],
    "seeds": [
      101
    ]
  },
  "failure": null,
  "provenance": {
    "git_commit": "a2ddcc55747b6b0e1a46451369a371734315ebff",
    "git_dirty": false,
    "gpu": {},
    "resolved_agent_sha256": null,
    "resolved_env_sha256": null,
    "software": {}
  },
  "run_id": "phase2_cartpole_controlled_ablation__R_CV2__seed7",
  "schema_version": 1,
  "status": "succeeded",
  "study_id": "phase2_cartpole_controlled_ablation",
  "training": {
    "checkpoint_vector_step": 2400,
    "num_envs": 4096,
    "seed": 7,
    "task": "Isaac-Cartpole-v0"
  },
  "variant": {
    "contrast_variant_id": "B0",
    "expected_diff": [
      {
        "path": "env.rewards.cart_vel.weight",
        "value": -0.02
      }
    ],
    "factor": "reward",
    "factor_level": -0.02,
    "id": "R_CV2",
    "interface_contract_sha256": "4f53cda18c2baa0c0354bb5f9a3ecbe5ed12ab4d8e11ba873c2f11161202b945",
    "registry_sha256": "72c2bf04bda3213469068e31c489e0439a51ab49cfef25ec022b998d3465fa5d"
  }
}
