{
  "artifacts": [
    {
      "kind": "train_R_CV0_seed42_console",
      "path_or_uri": "/workspace/phase2/cartpole_controlled_study/training_logs/R_CV0__seed42.log",
      "sha256": "0930526a809b23fc46f9ff87012a678f65a8709953b8ca78db34aabad060739c"
    },
    {
      "kind": "training_run_directory",
      "path_or_uri": "/workspace/isaaclab/logs/skrl/cartpole/2026-07-27_01-45-28_ppo_torch",
      "sha256": null
    },
    {
      "kind": "primary_checkpoint",
      "path_or_uri": "/workspace/isaaclab/logs/skrl/cartpole/2026-07-27_01-45-28_ppo_torch/checkpoints/agent_2400.pt",
      "sha256": "4e534d41320b9fcd6c3195a87148d903e64a95026e0c3e390662879dc6144374"
    },
    {
      "kind": "screening_R_CV0_console",
      "path_or_uri": "/workspace/phase2/cartpole_controlled_study/evaluation_logs/screening_R_CV0.log",
      "sha256": "f0af920a22495dd3c894d02d698a08f4c54cd78022a51e5936cadf836c59505d"
    },
    {
      "kind": "screening_evaluation",
      "path_or_uri": "/workspace/phase2/cartpole_controlled_study/evaluations/screening/R_CV0.json",
      "sha256": "496e02217affed2b9c51dfd6b8474b3c777ba974e3e9d126cd2157353f00a62c"
    },
    {
      "kind": "final_evaluation",
      "path_or_uri": "/workspace/phase2/cartpole_controlled_study/evaluations/final/R_CV0.json",
      "sha256": "6b51a4dd7718b8e833298f3f0986663e3f063cee28d8b7ed217dd6ee951a4382"
    }
  ],
  "commands": [
    {
      "command": "/workspace/isaaclab/isaaclab.sh -p scripts/reinforcement_learning/train.py --rl_library=skrl --task=Isaac-Cartpole-v0 --algorithm=PPO --seed=42 --num_envs=4096 --viz none env.rewards.cart_vel.weight=0.0",
      "ended_at": "2026-07-27T01:46:44.731611+00:00",
      "exit_code": 0,
      "stage": "train_R_CV0_seed42",
      "started_at": "2026-07-27T01:45:12.887049+00:00",
      "wall_seconds": 91.84427117700011
    },
    {
      "command": "/workspace/isaaclab/isaaclab.sh -p /workspace/robotics-issac-learning/tools/evaluate_cartpole.py --policy=sweep --task=Isaac-Cartpole-v0 --checkpoint-dir=/workspace/isaaclab/logs/skrl/cartpole/2026-07-27_01-45-28_ppo_torch/checkpoints --training-num-envs=4096 --seeds=101 --episodes-per-seed=25 --num-envs=25 --max-steps-per-seed=1000 --upright-threshold-degrees=12.0 --robust-success-upright-fraction=0.95 --action-sign-deadband=0.05 --output=/workspace/phase2/cartpole_controlled_study/evaluations/screening/R_CV0.json --viz none",
      "ended_at": "2026-07-27T02:26:05.349846+00:00",
      "exit_code": 0,
      "stage": "screening_R_CV0",
      "started_at": "2026-07-27T02:25:18.507171+00:00",
      "wall_seconds": 46.842384856999615
    }
  ],
  "evaluation": {
    "episodes_per_seed": 25,
    "fixed_environment_ids": [
      0,
      1,
      2,
      3,
      4,
      5,
      6,
      7,
      8,
      9,
      10,
      11,
      12,
      13,
      14,
      15,
      16,
      17,
      18,
      19,
      20,
      21,
      22,
      23,
      24
    ],
    "profile_ids": [
      "canonical5",
      "stress30"
    ],
    "seeds": [
      101
    ]
  },
  "failure": null,
  "provenance": {
    "git_commit": "a2ddcc55747b6b0e1a46451369a371734315ebff",
    "git_dirty": false,
    "gpu": {},
    "resolved_agent_sha256": null,
    "resolved_env_sha256": null,
    "software": {}
  },
  "run_id": "phase2_cartpole_controlled_ablation__R_CV0__seed42",
  "schema_version": 1,
  "status": "succeeded",
  "study_id": "phase2_cartpole_controlled_ablation",
  "training": {
    "checkpoint_vector_step": 2400,
    "num_envs": 4096,
    "seed": 42,
    "task": "Isaac-Cartpole-v0"
  },
  "variant": {
    "contrast_variant_id": "B0",
    "expected_diff": [
      {
        "path": "env.rewards.cart_vel.weight",
        "value": 0.0
      }
    ],
    "factor": "reward",
    "factor_level": 0.0,
    "id": "R_CV0",
    "interface_contract_sha256": "4f53cda18c2baa0c0354bb5f9a3ecbe5ed12ab4d8e11ba873c2f11161202b945",
    "registry_sha256": "72c2bf04bda3213469068e31c489e0439a51ab49cfef25ec022b998d3465fa5d"
  }
}
