{
  "artifacts": [
    {
      "kind": "train_A_E200_seed42_console",
      "path_or_uri": "/workspace/phase2/cartpole_controlled_study/training_logs/A_E200__seed42.log",
      "sha256": "71a2d0d4c8fceba6bad5cea742ef9530a30bf5262d13434925f3eac29558a4a2"
    },
    {
      "kind": "training_run_directory",
      "path_or_uri": "/workspace/isaaclab/logs/skrl/cartpole/2026-07-27_01-50-05_ppo_torch",
      "sha256": null
    },
    {
      "kind": "primary_checkpoint",
      "path_or_uri": "/workspace/isaaclab/logs/skrl/cartpole/2026-07-27_01-50-05_ppo_torch/checkpoints/agent_2400.pt",
      "sha256": "e9bf499cb49a3620b1e6909b56b2aab782eb2f439024709931c3de4ee2af0c97"
    },
    {
      "kind": "screening_A_E200_console",
      "path_or_uri": "/workspace/phase2/cartpole_controlled_study/evaluation_logs/screening_A_E200.log",
      "sha256": "74274f288625f768c2a936e95a2cc60d05077d71dbf233a43fccb94eae1fff06"
    },
    {
      "kind": "screening_evaluation",
      "path_or_uri": "/workspace/phase2/cartpole_controlled_study/evaluations/screening/A_E200.json",
      "sha256": "efc429310ac748f23f4abecd46e9c9192a3a219a4feab723e654a452534543f8"
    },
    {
      "kind": "final_evaluation",
      "path_or_uri": "/workspace/phase2/cartpole_controlled_study/evaluations/final/A_E200.json",
      "sha256": "7fc04cb42c80e90059b688b5919778fa6455ae3feeb27cefeae752bba71c443a"
    }
  ],
  "commands": [
    {
      "command": "/workspace/isaaclab/isaaclab.sh -p scripts/reinforcement_learning/train.py --rl_library=skrl --task=Isaac-Cartpole-v0 --algorithm=PPO --seed=42 --num_envs=4096 --viz none env.actions.joint_effort.scale=200.0",
      "ended_at": "2026-07-27T01:51:21.254862+00:00",
      "exit_code": 0,
      "stage": "train_A_E200_seed42",
      "started_at": "2026-07-27T01:49:49.191770+00:00",
      "wall_seconds": 92.06277566500012
    },
    {
      "command": "/workspace/isaaclab/isaaclab.sh -p /workspace/robotics-issac-learning/tools/evaluate_cartpole.py --policy=sweep --task=Isaac-Cartpole-v0 --checkpoint-dir=/workspace/isaaclab/logs/skrl/cartpole/2026-07-27_01-50-05_ppo_torch/checkpoints --training-num-envs=4096 --seeds=101 --episodes-per-seed=25 --num-envs=25 --max-steps-per-seed=1000 --upright-threshold-degrees=12.0 --robust-success-upright-fraction=0.95 --action-sign-deadband=0.05 --output=/workspace/phase2/cartpole_controlled_study/evaluations/screening/A_E200.json --viz none env.actions.joint_effort.scale=200.0",
      "ended_at": "2026-07-27T02:22:15.980065+00:00",
      "exit_code": 0,
      "stage": "screening_A_E200",
      "started_at": "2026-07-27T02:21:28.943686+00:00",
      "wall_seconds": 47.03604693200032
    }
  ],
  "evaluation": {
    "episodes_per_seed": 25,
    "fixed_environment_ids": [
      0,
      1,
      2,
      3,
      4,
      5,
      6,
      7,
      8,
      9,
      10,
      11,
      12,
      13,
      14,
      15,
      16,
      17,
      18,
      19,
      20,
      21,
      22,
      23,
      24
    ],
    "profile_ids": [
      "canonical5",
      "stress30"
    ],
    "seeds": [
      101
    ]
  },
  "failure": null,
  "provenance": {
    "git_commit": "a2ddcc55747b6b0e1a46451369a371734315ebff",
    "git_dirty": false,
    "gpu": {},
    "resolved_agent_sha256": null,
    "resolved_env_sha256": null,
    "software": {}
  },
  "run_id": "phase2_cartpole_controlled_ablation__A_E200__seed42",
  "schema_version": 1,
  "status": "succeeded",
  "study_id": "phase2_cartpole_controlled_ablation",
  "training": {
    "checkpoint_vector_step": 2400,
    "num_envs": 4096,
    "seed": 42,
    "task": "Isaac-Cartpole-v0"
  },
  "variant": {
    "contrast_variant_id": "B0",
    "expected_diff": [
      {
        "path": "env.actions.joint_effort.scale",
        "value": 200.0
      }
    ],
    "factor": "action",
    "factor_level": 200.0,
    "id": "A_E200",
    "interface_contract_sha256": "df910ddd6fcbf1671af81b920c622a10fa3ec06d1ebc17e6f08e3d2cb92bca96",
    "registry_sha256": "72c2bf04bda3213469068e31c489e0439a51ab49cfef25ec022b998d3465fa5d"
  }
}
