{
  "artifacts": [
    {
      "kind": "train_T_B15_seed42_console",
      "path_or_uri": "/workspace/phase2/cartpole_controlled_study/training_logs/T_B15__seed42.log",
      "sha256": "753afaabb6d46a12ea0b75b12356669822fbc15a61849ce3d74b439beb9267e3"
    },
    {
      "kind": "training_run_directory",
      "path_or_uri": "/workspace/isaaclab/logs/skrl/cartpole/2026-07-27_01-51-37_ppo_torch",
      "sha256": null
    },
    {
      "kind": "primary_checkpoint",
      "path_or_uri": "/workspace/isaaclab/logs/skrl/cartpole/2026-07-27_01-51-37_ppo_torch/checkpoints/agent_2400.pt",
      "sha256": "cbf332a027e9bb40be0e4563e747275ff51984c7b1a6fa06d72bb36589c3e650"
    },
    {
      "kind": "screening_T_B15_console",
      "path_or_uri": "/workspace/phase2/cartpole_controlled_study/evaluation_logs/screening_T_B15.log",
      "sha256": "7b30f2650f561412f8ac466e76f50d9f211c1fe1428665cbe188c429e4a72454"
    },
    {
      "kind": "screening_evaluation",
      "path_or_uri": "/workspace/phase2/cartpole_controlled_study/evaluations/screening/T_B15.json",
      "sha256": "a841d58863aa6062db0bcea6c7ea417fc529d19a60084bf036316326d6a0d32b"
    },
    {
      "kind": "final_evaluation",
      "path_or_uri": "/workspace/phase2/cartpole_controlled_study/evaluations/final/T_B15.json",
      "sha256": "9691451c0502385fa6dacdc1eaf877ae6b16f60aaf5c66bcceeb80349fdab5dc"
    }
  ],
  "commands": [
    {
      "command": "/workspace/isaaclab/isaaclab.sh -p scripts/reinforcement_learning/train.py --rl_library=skrl --task=Isaac-Cartpole-v0 --algorithm=PPO --seed=42 --num_envs=4096 --viz none 'env.terminations.cart_out_of_bounds.params.bounds=[-1.5,1.5]'",
      "ended_at": "2026-07-27T01:52:53.290296+00:00",
      "exit_code": 0,
      "stage": "train_T_B15_seed42",
      "started_at": "2026-07-27T01:51:21.257871+00:00",
      "wall_seconds": 92.03116961899991
    },
    {
      "command": "/workspace/isaaclab/isaaclab.sh -p /workspace/robotics-issac-learning/tools/evaluate_cartpole.py --policy=sweep --task=Isaac-Cartpole-v0 --checkpoint-dir=/workspace/isaaclab/logs/skrl/cartpole/2026-07-27_01-51-37_ppo_torch/checkpoints --training-num-envs=4096 --seeds=101 --episodes-per-seed=25 --num-envs=25 --max-steps-per-seed=1000 --upright-threshold-degrees=12.0 --robust-success-upright-fraction=0.95 --action-sign-deadband=0.05 --output=/workspace/phase2/cartpole_controlled_study/evaluations/screening/T_B15.json --viz none",
      "ended_at": "2026-07-27T02:27:37.046593+00:00",
      "exit_code": 0,
      "stage": "screening_T_B15",
      "started_at": "2026-07-27T02:26:50.154413+00:00",
      "wall_seconds": 46.891753450000124
    }
  ],
  "evaluation": {
    "episodes_per_seed": 25,
    "fixed_environment_ids": [
      0,
      1,
      2,
      3,
      4,
      5,
      6,
      7,
      8,
      9,
      10,
      11,
      12,
      13,
      14,
      15,
      16,
      17,
      18,
      19,
      20,
      21,
      22,
      23,
      24
    ],
    "profile_ids": [
      "canonical5",
      "stress30"
    ],
    "seeds": [
      101
    ]
  },
  "failure": null,
  "provenance": {
    "git_commit": "a2ddcc55747b6b0e1a46451369a371734315ebff",
    "git_dirty": false,
    "gpu": {},
    "resolved_agent_sha256": null,
    "resolved_env_sha256": null,
    "software": {}
  },
  "run_id": "phase2_cartpole_controlled_ablation__T_B15__seed42",
  "schema_version": 1,
  "status": "succeeded",
  "study_id": "phase2_cartpole_controlled_ablation",
  "training": {
    "checkpoint_vector_step": 2400,
    "num_envs": 4096,
    "seed": 42,
    "task": "Isaac-Cartpole-v0"
  },
  "variant": {
    "contrast_variant_id": "B0",
    "expected_diff": [
      {
        "path": "env.terminations.cart_out_of_bounds.params.bounds",
        "value": [
          -1.5,
          1.5
        ]
      }
    ],
    "factor": "termination",
    "factor_level": 1.5,
    "id": "T_B15",
    "interface_contract_sha256": "4f53cda18c2baa0c0354bb5f9a3ecbe5ed12ab4d8e11ba873c2f11161202b945",
    "registry_sha256": "72c2bf04bda3213469068e31c489e0439a51ab49cfef25ec022b998d3465fa5d"
  }
}
